{"jurisdiction_id":"az-carefree","jurisdiction_name":"Town of Carefree","default_source_doc":"az-carefree-zoning","zones":[
 {"zone_id":"az-carefree:rural-190","zone_code":"Rural-190","zone_name":"Rural Zoning District - 190,000 sf per dwelling","category":"residential","note_path":"","standards":{"min_lot_size_sf":190000,"min_lot_width_ft":300,"max_density_dua":"TBD","max_far":"TBD","max_lot_coverage_pct":6,"max_height_ft":24,"max_stories":"TBD","front_setback_ft":60,"side_setback_ft":30,"rear_setback_ft":60,"parking_ratio":null},"uses":{"permitted":[],"conditional":[],"prohibited":[]},"provenance":"official-html","confidence":"extracted","source_doc":"az-carefree-zoning","source_citation":"Zoning Ordinance Ch. 16, Art. VI, Sec. 6.01, Table 6.1 (Intensity Schedule)","source_page":null,"extracted_date":"2026-06-06","human_verified":"","notes":"Min lot area per dwelling unit 190,000 sf; ordinance states lot area per DU, not dua, so max_density_dua=TBD. Height per footnote (1): no part of principal structure may exceed 24 ft above design grade (Sec. 6.02(1)). Coverage = max lot area under roof. Source reachable via American Legal render-doc API."},
 {"zone_id":"az-carefree:rural-70","zone_code":"Rural-70","zone_name":"Rural Zoning District - 70,000 sf per dwelling","category":"residential","note_path":"","standards":{"min_lot_size_sf":70000,"min_lot_width_ft":230,"max_density_dua":"TBD","max_far":"TBD","max_lot_coverage_pct":13,"max_height_ft":24,"max_stories":"TBD","front_setback_ft":60,"side_setback_ft":30,"rear_setback_ft":60,"parking_ratio":null},"uses":{"permitted":[],"conditional":[],"prohibited":[]},"provenance":"official-html","confidence":"extracted","source_doc":"az-carefree-zoning","source_citation":"Zoning Ordinance Ch. 16, Art. VI, Sec. 6.01, Table 6.1","source_page":null,"extracted_date":"2026-06-06","human_verified":"","notes":"Min lot area per DU 70,000 sf. Height 24 ft (note 1). Coverage = max lot area under roof. Source via American Legal render-doc API."},
 {"zone_id":"az-carefree:rural-43","zone_code":"Rural-43","zone_name":"Rural Zoning District - 1 acre per dwelling","category":"residential","note_path":"","standards":{"min_lot_size_sf":43560,"min_lot_width_ft":145,"max_density_dua":"TBD","max_far":"TBD","max_lot_coverage_pct":17,"max_height_ft":24,"max_stories":"TBD","front_setback_ft":40,"side_setback_ft":30,"rear_setback_ft":40,"parking_ratio":null},"uses":{"permitted":[],"conditional":[],"prohibited":[]},"provenance":"official-html","confidence":"extracted","source_doc":"az-carefree-zoning","source_citation":"Zoning Ordinance Ch. 16, Art. VI, Sec. 6.01, Table 6.1","source_page":null,"extracted_date":"2026-06-06","human_verified":"","notes":"Min lot area per DU 43,560 sf (1 acre; original 'One (1) Acre'). Height 24 ft (note 1). Coverage = max lot area under roof. Source via American Legal render-doc API."},
 {"zone_id":"az-carefree:r1-35","zone_code":"R1-35","zone_name":"Single-Family Residential - 35,000 sf per dwelling","category":"residential","note_path":"","standards":{"min_lot_size_sf":35000,"min_lot_width_ft":145,"max_density_dua":"TBD","max_far":"TBD","max_lot_coverage_pct":20,"max_height_ft":24,"max_stories":"TBD","front_setback_ft":40,"side_setback_ft":20,"rear_setback_ft":40,"parking_ratio":null},"uses":{"permitted":[],"conditional":[],"prohibited":[]},"provenance":"official-html","confidence":"extracted","source_doc":"az-carefree-zoning","source_citation":"Zoning Ordinance Ch. 16, Art. VI, Sec. 6.01, Table 6.1","source_page":null,"extracted_date":"2026-06-06","human_verified":"","notes":"Min lot area per DU 35,000 sf. Height 24 ft (note 1). Coverage = max lot area under roof. Source via American Legal render-doc API."},
 {"zone_id":"az-carefree:r1-18","zone_code":"R1-18","zone_name":"Single-Family Residential - 18,000 sf per dwelling","category":"residential","note_path":"","standards":{"min_lot_size_sf":18000,"min_lot_width_ft":120,"max_density_dua":"TBD","max_far":"TBD","max_lot_coverage_pct":25,"max_height_ft":24,"max_stories":"TBD","front_setback_ft":30,"side_setback_ft":10,"rear_setback_ft":30,"parking_ratio":null},"uses":{"permitted":[],"conditional":[],"prohibited":[]},"provenance":"official-html","confidence":"extracted","source_doc":"az-carefree-zoning","source_citation":"Zoning Ordinance Ch. 16, Art. VI, Sec. 6.01, Table 6.1","source_page":null,"extracted_date":"2026-06-06","human_verified":"","notes":"Min lot area per DU 18,000 sf. Height 24 ft (note 1). Coverage = max lot area under roof. Source via American Legal render-doc API."},
 {"zone_id":"az-carefree:r1-10","zone_code":"R1-10","zone_name":"Single-Family Residential - 10,000 sf per dwelling","category":"residential","note_path":"","standards":{"min_lot_size_sf":10000,"min_lot_width_ft":80,"max_density_dua":"TBD","max_far":"TBD","max_lot_coverage_pct":30,"max_height_ft":24,"max_stories":"TBD","front_setback_ft":20,"side_setback_ft":7,"rear_setback_ft":25,"parking_ratio":null},"uses":{"permitted":[],"conditional":[],"prohibited":[]},"provenance":"official-html","confidence":"extracted","source_doc":"az-carefree-zoning","source_citation":"Zoning Ordinance Ch. 16, Art. VI, Sec. 6.01, Table 6.1","source_page":null,"extracted_date":"2026-06-06","human_verified":"","notes":"Min lot area per DU 10,000 sf. Height 24 ft (note 1). Coverage = max lot area under roof. Source via American Legal render-doc API."},
 {"zone_id":"az-carefree:r-3","zone_code":"R-3","zone_name":"Multiple-Family Residential Zoning District","category":"residential","note_path":"","standards":{"min_lot_size_sf":43560,"min_lot_width_ft":145,"max_density_dua":"TBD","max_far":"TBD","max_lot_coverage_pct":50,"max_height_ft":24,"max_stories":"TBD","front_setback_ft":25,"side_setback_ft":10,"rear_setback_ft":25,"parking_ratio":null},"uses":{"permitted":[],"conditional":[],"prohibited":[]},"provenance":"official-html","confidence":"extracted","source_doc":"az-carefree-zoning","source_citation":"Zoning Ordinance Ch. 16, Art. VI, Sec. 6.01, Table 6.1","source_page":null,"extracted_date":"2026-06-06","human_verified":"","notes":"Min lot area 43,560 sf; min lot area per DU 6,000 sf (lot-area-per-DU, not dua, so max_density_dua=TBD). Height 24 ft (note 1; (1)(G) allows certain roof screen-walls). Coverage = max area under roof. Source via American Legal render-doc API."},
 {"zone_id":"az-carefree:l","zone_code":"L","zone_name":"Lodging","category":"commercial","note_path":"","standards":{"min_lot_size_sf":43560,"min_lot_width_ft":145,"max_density_dua":"TBD","max_far":"TBD","max_lot_coverage_pct":60,"max_height_ft":30,"max_stories":"TBD","front_setback_ft":25,"side_setback_ft":10,"rear_setback_ft":25,"parking_ratio":null},"uses":{"permitted":[],"conditional":[],"prohibited":[]},"provenance":"official-html","confidence":"extracted","source_doc":"az-carefree-zoning","source_citation":"Zoning Ordinance Ch. 16, Art. VI, Sec. 6.01, Table 6.1","source_page":null,"extracted_date":"2026-06-06","human_verified":"","notes":"Height per footnote (2) = 30 ft. Coverage = max area under roof. No min lot area per DU (N/A). Source via American Legal render-doc API."},
 {"zone_id":"az-carefree:go","zone_code":"GO","zone_name":"Garden Office Zoning District","category":"commercial","note_path":"","standards":{"min_lot_size_sf":35000,"min_lot_width_ft":145,"max_density_dua":"TBD","max_far":"TBD","max_lot_coverage_pct":25,"max_height_ft":30,"max_stories":"TBD","front_setback_ft":40,"side_setback_ft":20,"rear_setback_ft":40,"parking_ratio":null},"uses":{"permitted":[],"conditional":[],"prohibited":[]},"provenance":"official-html","confidence":"extracted","source_doc":"az-carefree-zoning","source_citation":"Zoning Ordinance Ch. 16, Art. VI, Sec. 6.01, Table 6.1","source_page":null,"extracted_date":"2026-06-06","human_verified":"","notes":"Height per footnote (2) = 30 ft. Coverage = max area under roof. No min lot area per DU (N/A). Source via American Legal render-doc API."},
 {"zone_id":"az-carefree:c","zone_code":"C","zone_name":"Commercial Zoning District","category":"commercial","note_path":"","standards":{"min_lot_size_sf":6000,"min_lot_width_ft":60,"max_density_dua":"TBD","max_far":"TBD","max_lot_coverage_pct":60,"max_height_ft":30,"max_stories":"TBD","front_setback_ft":10,"side_setback_ft":0,"rear_setback_ft":0,"parking_ratio":null},"uses":{"permitted":[],"conditional":[],"prohibited":[]},"provenance":"official-html","confidence":"extracted","source_doc":"az-carefree-zoning","source_citation":"Zoning Ordinance Ch. 16, Art. VI, Sec. 6.01, Table 6.1","source_page":null,"extracted_date":"2026-06-06","human_verified":"","notes":"Height per footnote (2) = 30 ft. Min lot area 6,000 sf. Side yard min 0, rear yard min 0 per Table 6.1 (footnote (5) on rear). Coverage = max area under roof. Source via American Legal render-doc API."},
 {"zone_id":"az-carefree:os-r","zone_code":"OS-R","zone_name":"Open Space-Recreation Zoning District","category":"open-space","note_path":"","standards":{"min_lot_size_sf":"TBD","min_lot_width_ft":"TBD","max_density_dua":"TBD","max_far":"TBD","max_lot_coverage_pct":"TBD","max_height_ft":"TBD","max_stories":"TBD","front_setback_ft":"TBD","side_setback_ft":"TBD","rear_setback_ft":"TBD","parking_ratio":null},"uses":{"permitted":[],"conditional":[],"prohibited":[]},"provenance":"official-html","confidence":"extracted","source_doc":"az-carefree-zoning","source_citation":"Zoning Ordinance Ch. 16, Art. V, Sec. 5.03","source_page":null,"extracted_date":"2026-06-06","human_verified":"","notes":"OS-R is NOT in the Sec. 6.01 Table 6.1 intensity schedule. Per Sec. 5.03, OS-R has no numeric dimensional standards; development requires an approved master open space development plan (Town Council). All dimensional standards TBD. Source via American Legal render-doc API."}
]}
