{"jurisdiction_id":"az-paradise-valley","jurisdiction_name":"Town of Paradise Valley","default_source_doc":"az-paradise-valley-zoning","zones":[
 {"zone_id":"az-paradise-valley:r-175","zone_code":"R-175","zone_name":"Single-Family Residential (R-175)","category":"residential","note_path":"","standards":{"min_lot_size_sf":175000,"min_lot_width_ft":165,"max_density_dua":"TBD","max_far":0.25,"max_lot_coverage_pct":"TBD","max_height_ft":30,"max_stories":2,"front_setback_ft":40,"side_setback_ft":20,"rear_setback_ft":40,"parking_ratio":"2 spaces per dwelling unit"},"uses":{"permitted":["Single-family dwelling","Accessory buildings/uses (private garage, guesthouse, residential staff quarters)","Home occupation (Art. XVI)","Private swimming pool","Walls/fences (Art. XXIV)","Assisted Living Home (Art. XVII)","Temporary construction buildings","Keeping of horses (max 2 head per acre)","Tennis courts"],"conditional":[],"prohibited":[]},"provenance":"official-pdf","confidence":"extracted","source_doc":"az-paradise-valley-zoning","source_citation":"Zoning Ordinance Article X, Sec. 1001, Table 1001-A1 & Table 1001-A2 (Ord. 2021-01)","source_page":null,"extracted_date":"2026-06-06","human_verified":"","notes":"175,000 sf = 4.02 acres. Table 1001-A1: lots with a primary building built prior to 6/13/1991 use front/rear/side-with-frontage = 40 (used here); lots without require 100 ft. Side 20 min, but 40 for buildings 2 stories or >24 ft (footnote 2). max_height_ft=30 (lot >=4 ac). max_far 0.25 = Table 'Maximum Floor Area Ratio' 25%. No separate lot-coverage % (TBD). Height is lot-size-based per Table 1001-A2: <3 ac=24, 3-<4 ac=26, >=4 ac=30. Source: official Town PDF (DocumentCenter/View/117), curl with browser UA. Cover-sheet PDF in the folder was unusable."},
 {"zone_id":"az-paradise-valley:r-43","zone_code":"R-43","zone_name":"Single-Family Residential (R-43)","category":"residential","note_path":"","standards":{"min_lot_size_sf":43560,"min_lot_width_ft":165,"max_density_dua":"TBD","max_far":0.25,"max_lot_coverage_pct":"TBD","max_height_ft":24,"max_stories":2,"front_setback_ft":40,"side_setback_ft":20,"rear_setback_ft":40,"parking_ratio":"2 spaces per dwelling unit"},"uses":{"permitted":["Single-family dwelling","Accessory buildings/uses","Home occupation (Art. XVI)","Private swimming pool","Walls/fences (Art. XXIV)","Assisted Living Home (Art. XVII)","Temporary construction buildings","Keeping of horses (max 2 head per acre)","Tennis courts"],"conditional":[],"prohibited":[]},"provenance":"official-pdf","confidence":"extracted","source_doc":"az-paradise-valley-zoning","source_citation":"Zoning Ordinance Article X, Sec. 1001, Table 1001-A1 & Table 1001-A2 (Ord. 2021-01)","source_page":null,"extracted_date":"2026-06-06","human_verified":"","notes":"43,560 sf = 1.0 acre. max_height_ft=24 at min lot (<3 ac); rises to 26/30 on larger lots per Table 1001-A2. Also subject to 20% sky-plane height rule (R-43/R-175 non-hillside). max_far 0.25 = Table 25%. No separate lot-coverage % (TBD). Source: official Town PDF, curl with browser UA."},
 {"zone_id":"az-paradise-valley:r-35","zone_code":"R-35","zone_name":"Single-Family Residential (R-35)","category":"residential","note_path":"","standards":{"min_lot_size_sf":35000,"min_lot_width_ft":150,"max_density_dua":"TBD","max_far":0.25,"max_lot_coverage_pct":"TBD","max_height_ft":24,"max_stories":2,"front_setback_ft":40,"side_setback_ft":20,"rear_setback_ft":40,"parking_ratio":"2 spaces per dwelling unit"},"uses":{"permitted":["Single-family dwelling","Accessory buildings/uses","Home occupation (Art. XVI)","Private swimming pool","Walls/fences (Art. XXIV)","Assisted Living Home (Art. XVII)","Temporary construction buildings"],"conditional":[],"prohibited":[]},"provenance":"official-pdf","confidence":"extracted","source_doc":"az-paradise-valley-zoning","source_citation":"Zoning Ordinance Article X, Sec. 1001, Table 1001-A1 & Table 1001-A2 (Ord. 2021-01)","source_page":null,"extracted_date":"2026-06-06","human_verified":"","notes":"Side 20 min; per footnote 3, any second story must be set back 40, and on single-story buildings any portion >24 ft set back 40. max_height_ft=24 at min lot. max_far 0.25 = Table 25%. No separate lot-coverage % (TBD). Height lot-size-based (Table 1001-A2). Source: official Town PDF, curl with browser UA."},
 {"zone_id":"az-paradise-valley:r-35a","zone_code":"R-35A","zone_name":"Single-Family Residential (R-35A)","category":"residential","note_path":"","standards":{"min_lot_size_sf":35000,"min_lot_width_ft":150,"max_density_dua":"TBD","max_far":0.25,"max_lot_coverage_pct":"TBD","max_height_ft":24,"max_stories":1,"front_setback_ft":40,"side_setback_ft":15,"rear_setback_ft":40,"parking_ratio":"2 spaces per dwelling unit"},"uses":{"permitted":["Single-family dwelling","Accessory buildings/uses","Home occupation (Art. XVI)","Private swimming pool","Walls/fences (Art. XXIV)","Assisted Living Home (Art. XVII)","Temporary construction buildings"],"conditional":[],"prohibited":[]},"provenance":"official-pdf","confidence":"extracted","source_doc":"az-paradise-valley-zoning","source_citation":"Zoning Ordinance Article X, Sec. 1001, Table 1001-A1 & Table 1001-A2 (Ord. 2021-01)","source_page":null,"extracted_date":"2026-06-06","human_verified":"","notes":"R-35A applies only to annexed subdivisions Firebrand Ranch and Mountain View Estates Replat. Side 15 min; footnote 3 second-story/over-24-ft 40-ft setback rule applies. Max 1 story. max_height_ft=24 at min lot. max_far 0.25. No separate lot-coverage % (TBD). Source: official Town PDF, curl with browser UA."},
 {"zone_id":"az-paradise-valley:r-18","zone_code":"R-18","zone_name":"Single-Family Residential (R-18)","category":"residential","note_path":"","standards":{"min_lot_size_sf":18000,"min_lot_width_ft":120,"max_density_dua":"TBD","max_far":0.25,"max_lot_coverage_pct":"TBD","max_height_ft":24,"max_stories":1,"front_setback_ft":40,"side_setback_ft":20,"rear_setback_ft":40,"parking_ratio":"2 spaces per dwelling unit"},"uses":{"permitted":["Single-family dwelling","Accessory buildings/uses","Home occupation (Art. XVI)","Private swimming pool","Walls/fences (Art. XXIV)","Assisted Living Home (Art. XVII)","Temporary construction buildings"],"conditional":[],"prohibited":[]},"provenance":"official-pdf","confidence":"extracted","source_doc":"az-paradise-valley-zoning","source_citation":"Zoning Ordinance Article X, Sec. 1001, Table 1001-A1 & Table 1001-A2 (Ord. 2021-01)","source_page":null,"extracted_date":"2026-06-06","human_verified":"","notes":"Side 20. Max 1 story. max_height_ft=24 at min lot. max_far 0.25 = Table 25%. No separate lot-coverage % (TBD). Height lot-size-based (Table 1001-A2). Source: official Town PDF, curl with browser UA."},
 {"zone_id":"az-paradise-valley:r-18a","zone_code":"R-18A","zone_name":"Single-Family Residential (R-18A)","category":"residential","note_path":"","standards":{"min_lot_size_sf":18000,"min_lot_width_ft":120,"max_density_dua":"TBD","max_far":0.25,"max_lot_coverage_pct":"TBD","max_height_ft":24,"max_stories":1,"front_setback_ft":35,"side_setback_ft":10,"rear_setback_ft":35,"parking_ratio":"2 spaces per dwelling unit"},"uses":{"permitted":["Single-family dwelling","Accessory buildings/uses","Home occupation (Art. XVI)","Private swimming pool","Walls/fences (Art. XXIV)","Assisted Living Home (Art. XVII)","Temporary construction buildings"],"conditional":[],"prohibited":[]},"provenance":"official-pdf","confidence":"extracted","source_doc":"az-paradise-valley-zoning","source_citation":"Zoning Ordinance Article X, Sec. 1001, Table 1001-A1 & Table 1001-A2 (Ord. 2021-01)","source_page":null,"extracted_date":"2026-06-06","human_verified":"","notes":"R-18A applies only to specified annexed subdivisions (Firebrand Ranch, Mountain View Estates Replat, Arcadia Square, Orange Valley Estates No 3, Grosse Point Two, Quail Vista). Front 35, side 10, rear 35, side/rear-with-frontage 35. Max 1 story. max_height_ft=24 at min lot. max_far 0.25. No separate lot-coverage % (TBD). Source: official Town PDF, curl with browser UA."},
 {"zone_id":"az-paradise-valley:r-10","zone_code":"R-10","zone_name":"Single-Family Residential (R-10)","category":"residential","note_path":"","standards":{"min_lot_size_sf":10000,"min_lot_width_ft":100,"max_density_dua":"TBD","max_far":"TBD","max_lot_coverage_pct":"TBD","max_height_ft":24,"max_stories":1,"front_setback_ft":20,"side_setback_ft":7,"rear_setback_ft":25,"parking_ratio":"2 spaces per dwelling unit"},"uses":{"permitted":["Single-family dwelling","Accessory buildings/uses","Home occupation (Art. XVI)","Private swimming pool","Walls/fences (Art. XXIV)","Assisted Living Home (Art. XVII)","Temporary construction buildings"],"conditional":[],"prohibited":[]},"provenance":"official-pdf","confidence":"extracted","source_doc":"az-paradise-valley-zoning","source_citation":"Zoning Ordinance Article X, Sec. 1001, Table 1001-A1 & Table 1001-A2 (Ord. 2021-01)","source_page":null,"extracted_date":"2026-06-06","human_verified":"","notes":"R-10 applies only to annexed subdivisions Mountain Shadows East/West and Colonia Miramonte. Setbacks (front 20, side 7, rear 25, side/rear-with-frontage 20) apply 'or as shown on a previously recorded plat, or as existing at time of annexation' (footnote 4). Maximum Floor Area Ratio = 'None' per Table 1001-A1, so max_far=TBD. Max 1 story. max_height_ft=24 at min lot. Horses/livestock/poultry prohibited. Source: official Town PDF (DocumentCenter/View/117 + View/116), curl with browser UA."}
]}
