{"jurisdiction_id":"az-el-mirage","jurisdiction_name":"City of El Mirage","default_source_doc":"az-el-mirage-zoning","zones":[
 {"zone_id":"az-el-mirage:nr","zone_code":"NR","zone_name":"Natural Reserve","category":"open-space","note_path":"","standards":{"min_lot_size_sf":"TBD","min_lot_width_ft":"TBD","max_density_dua":"TBD","max_far":"TBD","max_lot_coverage_pct":"TBD","max_height_ft":"TBD","max_stories":"TBD","front_setback_ft":"TBD","side_setback_ft":"TBD","rear_setback_ft":"TBD","parking_ratio":null},"uses":{"permitted":[],"conditional":[],"prohibited":[]},"provenance":"official-html","confidence":"extracted","source_doc":"az-el-mirage-zoning","source_citation":"§ 154.053 Table of Zone Standards","source_page":null,"extracted_date":"2026-06-06","human_verified":"","notes":"Source reachable (HTTP 200 via browser User-Agent). All NR dimensional standards listed as 'per site plan' in the § 154.053 table — no fixed numeric values; hence TBD. NR preserves park/drainage/natural open space (§ 154.050(A)(1))."},
 {"zone_id":"az-el-mirage:ra","zone_code":"RA","zone_name":"Rural Area","category":"residential","note_path":"","standards":{"min_lot_size_sf":43560,"min_lot_width_ft":120,"max_density_dua":"TBD","max_far":"TBD","max_lot_coverage_pct":25,"max_height_ft":30,"max_stories":2,"front_setback_ft":30,"side_setback_ft":20,"rear_setback_ft":30,"parking_ratio":null},"uses":{"permitted":[],"conditional":[],"prohibited":[]},"provenance":"official-html","confidence":"extracted","source_doc":"az-el-mirage-zoning","source_citation":"§ 154.053 Table of Zone Standards","source_page":null,"extracted_date":"2026-06-06","human_verified":"","notes":"side_setback_ft = interior side minimum 20 (side-street also 20). Rear 30 generally; footnote **** reduces rear to 15 for developments over 30 acres. No density/FAR/parking columns. Lot area 43,560 sf = 1 acre."},
 {"zone_id":"az-el-mirage:sn","zone_code":"SN","zone_name":"Suburban Neighborhood","category":"residential","note_path":"","standards":{"min_lot_size_sf":5000,"min_lot_width_ft":45,"max_density_dua":"TBD","max_far":"TBD","max_lot_coverage_pct":55,"max_height_ft":30,"max_stories":2,"front_setback_ft":20,"side_setback_ft":5,"rear_setback_ft":20,"parking_ratio":null},"uses":{"permitted":[],"conditional":[],"prohibited":[]},"provenance":"official-html","confidence":"extracted","source_doc":"az-el-mirage-zoning","source_citation":"§ 154.053 Table of Zone Standards","source_page":null,"extracted_date":"2026-06-06","human_verified":"","notes":"side_setback_ft = interior side 5 (side-street 10). No density/FAR/parking columns."},
 {"zone_id":"az-el-mirage:mp","zone_code":"MP","zone_name":"Mobile/Manufactured Park","category":"residential","note_path":"","standards":{"min_lot_size_sf":2000,"min_lot_width_ft":40,"max_density_dua":"TBD","max_far":"TBD","max_lot_coverage_pct":80,"max_height_ft":30,"max_stories":2,"front_setback_ft":5,"side_setback_ft":5,"rear_setback_ft":5,"parking_ratio":null},"uses":{"permitted":[],"conditional":[],"prohibited":[]},"provenance":"official-html","confidence":"extracted","source_doc":"az-el-mirage-zoning","source_citation":"§ 154.053 Table of Zone Standards","source_page":null,"extracted_date":"2026-06-06","human_verified":"","notes":"side_setback_ft = interior side 5 (footnote *: no setback required if structure is fire-resistant per IBC/IFC); side-street 10. Height (30/2 stories) footnote **: may be exceeded with CUP. No density/FAR/parking columns."},
 {"zone_id":"az-el-mirage:mu","zone_code":"MU","zone_name":"Mixed Urban","category":"mixed-use","note_path":"","standards":{"min_lot_size_sf":4000,"min_lot_width_ft":40,"max_density_dua":"TBD","max_far":"TBD","max_lot_coverage_pct":90,"max_height_ft":30,"max_stories":2,"front_setback_ft":10,"side_setback_ft":5,"rear_setback_ft":10,"parking_ratio":null},"uses":{"permitted":[],"conditional":[],"prohibited":[]},"provenance":"official-html","confidence":"extracted","source_doc":"az-el-mirage-zoning","source_citation":"§ 154.053 Table of Zone Standards","source_page":null,"extracted_date":"2026-06-06","human_verified":"","notes":"side_setback_ft = interior side 5 (footnote *: 0 if fire-resistant per IBC/IFC); side-street 10. Height footnote **: may be exceeded with CUP. No density/FAR/parking columns."},
 {"zone_id":"az-el-mirage:uc","zone_code":"UC","zone_name":"Urban Corridor","category":"commercial","note_path":"","standards":{"min_lot_size_sf":2000,"min_lot_width_ft":20,"max_density_dua":"TBD","max_far":"TBD","max_lot_coverage_pct":90,"max_height_ft":40,"max_stories":3,"front_setback_ft":5,"side_setback_ft":5,"rear_setback_ft":5,"parking_ratio":null},"uses":{"permitted":[],"conditional":[],"prohibited":[]},"provenance":"official-html","confidence":"extracted","source_doc":"az-el-mirage-zoning","source_citation":"§ 154.053 Table of Zone Standards","source_page":null,"extracted_date":"2026-06-06","human_verified":"","notes":"All setbacks footnote *: 5 min, 0 if fire-resistant per IBC/IFC; side-street also 5. Height footnote **: may be exceeded with CUP. No density/FAR/parking columns."},
 {"zone_id":"az-el-mirage:td","zone_code":"TD","zone_name":"Transit Development","category":"mixed-use","note_path":"","standards":{"min_lot_size_sf":1000,"min_lot_width_ft":20,"max_density_dua":"TBD","max_far":"TBD","max_lot_coverage_pct":90,"max_height_ft":70,"max_stories":5,"front_setback_ft":5,"side_setback_ft":5,"rear_setback_ft":5,"parking_ratio":null},"uses":{"permitted":[],"conditional":[],"prohibited":[]},"provenance":"official-html","confidence":"extracted","source_doc":"az-el-mirage-zoning","source_citation":"§ 154.053 Table of Zone Standards","source_page":null,"extracted_date":"2026-06-06","human_verified":"","notes":"All setbacks footnote *: 5 min, 0 if fire-resistant per IBC/IFC; side-street also 5. Height (70/5 stories) footnote **: may be exceeded with CUP. No density/FAR/parking columns."},
 {"zone_id":"az-el-mirage:cp","zone_code":"CP","zone_name":"Commerce Park","category":"industrial","note_path":"","standards":{"min_lot_size_sf":2000,"min_lot_width_ft":50,"max_density_dua":"TBD","max_far":"TBD","max_lot_coverage_pct":90,"max_height_ft":66,"max_stories":"TBD","front_setback_ft":20,"side_setback_ft":5,"rear_setback_ft":5,"parking_ratio":null},"uses":{"permitted":[],"conditional":[],"prohibited":[]},"provenance":"official-html","confidence":"extracted","source_doc":"az-el-mirage-zoning","source_citation":"§ 154.053 Table of Zone Standards","source_page":null,"extracted_date":"2026-06-06","human_verified":"","notes":"CP and EI share a combined 'CP/EI' column. Interior side and rear footnote *: 5 min, 0 if fire-resistant per IBC/IFC; side-street 10, front 20. Height '66 ft' with no story count (TBD); footnote **: may be exceeded with CUP. No density/FAR/parking columns."},
 {"zone_id":"az-el-mirage:ei","zone_code":"EI","zone_name":"Employment/Industry","category":"industrial","note_path":"","standards":{"min_lot_size_sf":2000,"min_lot_width_ft":50,"max_density_dua":"TBD","max_far":"TBD","max_lot_coverage_pct":90,"max_height_ft":66,"max_stories":"TBD","front_setback_ft":20,"side_setback_ft":5,"rear_setback_ft":5,"parking_ratio":null},"uses":{"permitted":[],"conditional":[],"prohibited":[]},"provenance":"official-html","confidence":"extracted","source_doc":"az-el-mirage-zoning","source_citation":"§ 154.053 Table of Zone Standards","source_page":null,"extracted_date":"2026-06-06","human_verified":"","notes":"EI and CP share a combined 'CP/EI' column. Interior side and rear footnote *: 5 min, 0 if fire-resistant per IBC/IFC; side-street 10, front 20. Height '66 ft' with no story count (TBD); footnote **: may be exceeded with CUP. No density/FAR/parking columns."}
]}
