{"jurisdiction_id":"az-youngtown","jurisdiction_name":"Town of Youngtown","default_source_doc":"az-youngtown-zoning","zones":[
 {"zone_id":"az-youngtown:r","zone_code":"R","zone_name":"Rural District","category":"agricultural","note_path":"","standards":{"min_lot_size_sf":"TBD","min_lot_width_ft":"TBD","max_density_dua":"TBD","max_far":"TBD","max_lot_coverage_pct":"TBD","max_height_ft":"TBD","max_stories":"TBD","front_setback_ft":40,"side_setback_ft":7,"rear_setback_ft":25,"parking_ratio":null},"uses":{"permitted":["public/private forest and wildlife reservation","golf course","private club and fraternal organization","hospitals/medical clinics/institutions (min 5-acre site)","pharmacy","pumping/booster/substation","accessory buildings","TV/radio transmitter tower","wireless communications facilities"],"conditional":[],"prohibited":[]},"provenance":"official-html","confidence":"extracted","source_doc":"az-youngtown-zoning","source_citation":"Youngtown Title 17, Ch. 17.20 (17.20.030-.060)","source_page":null,"extracted_date":"2026-06-06","human_verified":"","notes":"Reached via api.municode.com (clientId 10060, productId 16710, jobId 471572). Front 40. Side = 30 ft or 10% of lot width, whichever smaller, not less than 7 (binding minimum 7). Rear = 40 ft or 20% of depth, whichever smaller, not less than 25 (binding minimum 25). No min lot area/width, coverage, or general height limit for R district (TBD)."},
 {"zone_id":"az-youngtown:r-43","zone_code":"R-43","zone_name":"Rural Residential Dwelling District","category":"residential","note_path":"","standards":{"min_lot_size_sf":43560,"min_lot_width_ft":145,"max_density_dua":1,"max_far":"TBD","max_lot_coverage_pct":15,"max_height_ft":30,"max_stories":2,"front_setback_ft":40,"side_setback_ft":30,"rear_setback_ft":40,"parking_ratio":null},"uses":{"permitted":["single-family dwelling","farms","group homes for the handicapped","public schools","private/charter schools (with standards)","wireless communications facilities","home occupation"],"conditional":["forests/wildlife reservations","fire/police stations and post offices","golf courses","libraries/museums/parks/community buildings","roadside stands","plant nurseries/greenhouses","corrals for horses","group homes","accessory buildings"],"prohibited":[]},"provenance":"official-html","confidence":"extracted","source_doc":"az-youngtown-zoning","source_citation":"Youngtown Title 17, Ch. 17.22 (17.22.030-.070)","source_page":null,"extracted_date":"2026-06-06","human_verified":"","notes":"Min lot 1 acre (43,560 sf); width 145. One dwelling unit per lot -> 1 du/ac. Max coverage 15%."},
 {"zone_id":"az-youngtown:r-3","zone_code":"R-3","zone_name":"Single-Family Dwelling District","category":"residential","note_path":"","standards":{"min_lot_size_sf":6000,"min_lot_width_ft":60,"max_density_dua":"TBD","max_far":"TBD","max_lot_coverage_pct":"TBD","max_height_ft":30,"max_stories":2,"front_setback_ft":25,"side_setback_ft":7,"rear_setback_ft":35,"parking_ratio":null},"uses":{"permitted":["single-family dwelling","golf course","home occupations","accessory buildings","temporary construction buildings","group homes for the handicapped","wireless communications facilities"],"conditional":[],"prohibited":[]},"provenance":"official-html","confidence":"extracted","source_doc":"az-youngtown-zoning","source_citation":"Youngtown Title 17, Ch. 17.24 (17.24.030-.070)","source_page":null,"extracted_date":"2026-06-06","human_verified":"","notes":"Min lot 6,000 sf, width 60; min dwelling living area 1,000 sf. Side = 7 ft or 15% of width, whichever smaller (binding minimum 7). Rear = 35 ft or 20% of depth, whichever smaller (binding minimum 35). Accessory max 15 ft. No coverage standard (TBD)."},
 {"zone_id":"az-youngtown:r-2","zone_code":"R-2","zone_name":"Two-Family Dwelling District","category":"residential","note_path":"","standards":{"min_lot_size_sf":6000,"min_lot_width_ft":"TBD","max_density_dua":12.45,"max_far":"TBD","max_lot_coverage_pct":"TBD","max_height_ft":30,"max_stories":2,"front_setback_ft":20,"side_setback_ft":5,"rear_setback_ft":35,"parking_ratio":null},"uses":{"permitted":["any R-1 single-family use","two-family dwelling","fences","group homes for the handicapped","wireless communications facilities","home occupation"],"conditional":[],"prohibited":[]},"provenance":"official-html","confidence":"extracted","source_doc":"az-youngtown-zoning","source_citation":"Youngtown Title 17, Ch. 17.28 (17.28.030-.070)","source_page":null,"extracted_date":"2026-06-06","human_verified":"","notes":"Single-family lot min 6,000 sf; two-family 3,500 sf per family -> density 43,560/3,500 = 12.45. Rear = 35 ft or 20% of depth (binding minimum 35). Height per R-3 (2 stories/30 ft). No coverage (TBD)."},
 {"zone_id":"az-youngtown:r-1","zone_code":"R-1","zone_name":"Multiple-Family Dwelling District","category":"residential","note_path":"","standards":{"min_lot_size_sf":6000,"min_lot_width_ft":"TBD","max_density_dua":17.42,"max_far":"TBD","max_lot_coverage_pct":"TBD","max_height_ft":30,"max_stories":2,"front_setback_ft":20,"side_setback_ft":5,"rear_setback_ft":35,"parking_ratio":null},"uses":{"permitted":["any R-2 two-family use","multiple-family dwelling","nonprofit/philanthropic institutions","accessory buildings","group homes for the handicapped","wireless communications facilities"],"conditional":["homeless shelter (special use permit)"],"prohibited":[]},"provenance":"official-html","confidence":"extracted","source_doc":"az-youngtown-zoning","source_citation":"Youngtown Title 17, Ch. 17.32 (17.32.030-.070)","source_page":null,"extracted_date":"2026-06-06","human_verified":"","notes":"Single-family lot min 6,000 sf. Per-family minimums: 3,500 (2-family), 3,000 (3-family), 2,500 (4+ units). Highest density at 2,500 sf/unit -> 43,560/2,500 = 17.42. Rear = 35 ft or 20% of depth (binding minimum 35). Height per R-3. No coverage (TBD)."},
 {"zone_id":"az-youngtown:c-1","zone_code":"C-1","zone_name":"C-1 Commercial District","category":"commercial","note_path":"","standards":{"min_lot_size_sf":"TBD","min_lot_width_ft":"TBD","max_density_dua":"TBD","max_far":"TBD","max_lot_coverage_pct":"TBD","max_height_ft":24,"max_stories":2,"front_setback_ft":20,"side_setback_ft":0,"rear_setback_ft":0,"parking_ratio":null},"uses":{"permitted":["retail stores and shops","offices and professional services","bank","restaurant/cafe","medical clinic","personal service shops","apartment houses (max 2 stories/24 ft, or 48 ft/4 stories in redevelopment district)","service station","theater (not drive-in)","parking lot","wireless communications facilities"],"conditional":["children's residential care facility","residential health care facility","homeless shelter"],"prohibited":[]},"provenance":"official-html","confidence":"extracted","source_doc":"az-youngtown-zoning","source_citation":"Youngtown Title 17, Ch. 17.36 (17.36.060-.090)","source_page":null,"extracted_date":"2026-06-06","human_verified":"","notes":"Height max 2 stories/24 ft (48 ft/4 stories within redevelopment district per Res. 00-09). Front 20. Side: none required unless adjoining a dwelling district (then 7); if provided min 3 (binding minimum 0). Rear: none unless adjoining a dwelling district (then 20) (binding minimum 0). No min lot area/coverage (TBD)."},
 {"zone_id":"az-youngtown:c-2","zone_code":"C-2","zone_name":"C-2 Commercial District","category":"commercial","note_path":"","standards":{"min_lot_size_sf":"TBD","min_lot_width_ft":"TBD","max_density_dua":"TBD","max_far":"TBD","max_lot_coverage_pct":"TBD","max_height_ft":24,"max_stories":2,"front_setback_ft":25,"side_setback_ft":0,"rear_setback_ft":0,"parking_ratio":null},"uses":{"permitted":["any C-1 use","auto car wash","bars and nightclubs","catering establishment","garage repair shop","hotel or motel","nursery and greenhouse","sales/show room","tire store","mini-storage facility","vehicle storage facility","municipal and public safety facilities"],"conditional":["medical marijuana cultivation/dispensary","sexually oriented businesses (special use permit)"],"prohibited":[]},"provenance":"official-html","confidence":"extracted","source_doc":"az-youngtown-zoning","source_citation":"Youngtown Title 17, Ch. 17.40 (17.40.040-.070)","source_page":null,"extracted_date":"2026-06-06","human_verified":"","notes":"Height max 2 stories/24 ft (48 ft/4 stories within redevelopment district per Res. 00-08). Front 25. Side: none unless adjoining residential (then 7); if provided min 3 (binding minimum 0). Rear: none unless adjoining a dwelling district (then 20) (binding minimum 0). No min lot area/coverage (TBD)."},
 {"zone_id":"az-youngtown:p","zone_code":"P","zone_name":"Open Space District","category":"open-space","note_path":"","standards":{"min_lot_size_sf":"TBD","min_lot_width_ft":"TBD","max_density_dua":"TBD","max_far":"TBD","max_lot_coverage_pct":"TBD","max_height_ft":15,"max_stories":1,"front_setback_ft":"TBD","side_setback_ft":"TBD","rear_setback_ft":"TBD","parking_ratio":null},"uses":{"permitted":["parks, open space and recreation","recreation facilities and sports fields","public/private forest and wildlife reservations","golf course","accessory buildings","riding stables"],"conditional":[],"prohibited":[]},"provenance":"official-html","confidence":"extracted","source_doc":"az-youngtown-zoning","source_citation":"Youngtown Title 17, Ch. 17.50 (17.50.030)","source_page":null,"extracted_date":"2026-06-06","human_verified":"","notes":"Open Space / Park district. Only height regulated (1 story / 15 ft); code states no lot area, width, yard/setback, density, or coverage standards (TBD)."}
]}
